{
  "schema_version": "0.1.0",
  "twin_id": "SYNTHETIC_TWIN_001",
  "event_id": "evt_demo_001",
  "event_type": "PATHOLOGY_RESULT",
  "effective_time": "2026-09-01T10:00:00Z",
  "received_time": "2026-09-01T10:00:00Z",
  "source": "synthetic",
  "quality_status": "warning",
  "provenance": {
    "source_system": "handcrafted-demo",
    "source_record_id": "demo_001",
    "data_version": "synthetic-0.1.0"
  },
  "payload": {
    "tumour_size_mm": 31,
    "grade": 2,
    "positive_nodes": 3,
    "her2_status": null
  }
}
